[
 {
  "actor": "City Auditor",
  "citations": [
   {
    "locator": "PDF p. 4",
    "source_id": "src-contracts-audit-2026"
   }
  ],
  "commitment_ids": [],
  "date": "2026-02-19",
  "description": "The City Auditor issued the audit report, with 13 recommendations and City management's responses.",
  "id": "contracts-audit-2026-event-report",
  "kind": "report_issued",
  "matter_id": "contracts-audit-2026",
  "recommendation_ids": []
 },
 {
  "actor": "City Auditor",
  "citations": [
   {
    "locator": "City Auditor Comments",
    "quote": "The City Auditor provided a presentation on the City Contracts audit. 5 speakers.",
    "source_id": "src-bcc-2026-03-10-annotated-agenda"
   }
  ],
  "commitment_ids": [],
  "date": "2026-03-10",
  "description": "The City Auditor presented the audit to the City Council.",
  "id": "contracts-audit-2026-event-presentation",
  "kind": "presentation",
  "matter_id": "contracts-audit-2026",
  "recommendation_ids": []
 },
 {
  "actor": "City Council",
  "citations": [
   {
    "locator": "Consent Calendar, Item 6",
    "quote": "Action: Approved recommendation.",
    "source_id": "src-bcc-2026-03-10-annotated-agenda"
   }
  ],
  "commitment_ids": [
   "contracts-audit-2026-report-back"
  ],
  "date": "2026-03-10",
  "description": "On the Consent Calendar, the City Council approved the Auditor's recommendation that the City Manager report back by Fall 2026 and annually thereafter.",
  "id": "contracts-audit-2026-event-council-approval",
  "kind": "council_action",
  "matter_id": "contracts-audit-2026",
  "recommendation_ids": []
 },
 {
  "actor": "City Auditor",
  "citations": [
   {
    "locator": "PDF p. 2",
    "quote": "Our contracts audit has already led to a Councilmember proposal to amend the Berkeley Municipal Code to require competition for service contracts greater than $100,000.",
    "source_id": "src-auditor-plan-fy2027"
   },
   {
    "locator": "Information Reports, Item 50",
    "quote": "Action: Received and filed.",
    "source_id": "src-bcc-2026-06-30-annotated-agenda"
   }
  ],
  "commitment_ids": [],
  "date": "2026-06-30",
  "description": "In its FY 2027 audit plan, filed with the City Council on June 30, 2026, the City Auditor reported that the audit had led to a Councilmember proposal to amend the Municipal Code.",
  "id": "contracts-audit-2026-event-auditor-plan-proposal",
  "kind": "reported_development",
  "matter_id": "contracts-audit-2026",
  "recommendation_ids": [
   "contracts-audit-2026-rec-1.2"
  ]
 },
 {
  "actor": "City Auditor",
  "citations": [
   {
    "locator": "PDF p. 4",
    "quote": "The Not Started category includes 19 recommendations from the recently released Homeless Response Team audit and contracts audit, which we will follow up on for the first time in FY 2027.",
    "source_id": "src-auditor-plan-fy2027"
   },
   {
    "locator": "Information Reports, Item 50",
    "quote": "Action: Received and filed.",
    "source_id": "src-bcc-2026-06-30-annotated-agenda"
   }
  ],
  "commitment_ids": [],
  "date": "2026-06-30",
  "description": "In its FY 2027 audit plan, filed with the City Council on June 30, 2026, the City Auditor scheduled its first follow-up on the audit's recommendations for FY 2027.",
  "id": "contracts-audit-2026-event-auditor-plan-followup",
  "kind": "reported_development",
  "matter_id": "contracts-audit-2026",
  "recommendation_ids": []
 },
 {
  "actor": "City Council",
  "citations": [
   {
    "locator": "Item 28, Action (p. 13)",
    "quote": "Moved to Consent Calendar. Approved the recommended actions presented in Supplemental Communications Packet #2 from Councilmember Hahn, amended to only apply to Area C. 1. Direct the City Manager to issue permits to Berkeley High School pursuant to Berkeley Municipal Code Chapter 14.72, which allows the City to issue a number of permits equal to up to 60% of the school’s employees, in the same or other RPP Areas, in conformance with criteria found in Sections 14.72.080 and 14.72.105. 2. Direct the City Manager to issue such permits in RPP Area C, or in a combination of Areas C, J and/or E, in consultation with the Councilmember representing the majority of potentially impacted areas of RPP Areas C, J and E. 3. With respect to BMC Sections 14.72.080 (B) and 14.72.105(B)(1), (2), (3), and (6), the Berkeley City Council hereby takes the following actions: Pursuant to BMC 14.72.105(B)(1), the Berkeley City Council finds that inadequate off-street parking for Berkeley High School exists and there is no financially feasible way of creating adequate off-street parking on the site of Berkeley High School. The cost estimated by BUSD is more than $25 million to create such parking; this cost is deemed",
    "source_id": "src-bcc-2024-01-16-regular-annotated-agenda"
   }
  ],
  "commitment_ids": [
   "berkeley-high-school-staff-parking-permits-2024--2024-01-16--item-28"
  ],
  "date": "2024-01-16",
  "description": "Item 28, \"Consideration of Options for Berkeley High School Staff Parking\", was on the agenda, with the recorded action quoted.",
  "id": "berkeley-high-school-staff-parking-permits-2024--2024-01-16--item-28--action",
  "kind": "council_action",
  "matter_id": "berkeley-high-school-staff-parking-permits-2024",
  "recommendation_ids": []
 },
 {
  "actor": "City Council",
  "citations": [
   {
    "locator": "Item 29, Action (p. 15)",
    "quote": "Moved to Consent Calendar. Approved the item as recommended by the Land Use, Housing, & Economic Development Committee with the following amendment. “Refer to the City Manager and Planning Commission to consider and develop report back on policies to permit neighborhood-scale retail uses in residential zones to increase economic opportunity, vitality, and walkability in Berkeley neighborhoods.”",
    "source_id": "src-bcc-2024-01-16-regular-annotated-agenda"
   }
  ],
  "commitment_ids": [
   "neighborhood-scale-commercial-2024--2024-01-16--item-29"
  ],
  "date": "2024-01-16",
  "description": "Item 29, \"Referral: Neighborhood-Scale Commercial (Reviewed by the Land Use, Housing, & Economic Development Committee)\", was on the agenda, with the recorded action quoted.",
  "id": "neighborhood-scale-commercial-2024--2024-01-16--item-29--action",
  "kind": "council_action",
  "matter_id": "neighborhood-scale-commercial-2024",
  "recommendation_ids": []
 },
 {
  "actor": "City Council",
  "citations": [
   {
    "locator": "Item 12, Action (p. 7)",
    "quote": "Approved recommendation as amended to read as follows. Refer to the City Manager to analyze and develop recommendations for public safety crime prevention programs to address the current rising crime against women, particularly",
    "source_id": "src-bcc-2024-02-13-regular-annotated-agenda"
   }
  ],
  "commitment_ids": [
   "crime-prevention-women-2024--2024-02-13--item-12"
  ],
  "date": "2024-02-13",
  "description": "Item 12, \"Recommendation on Public Safety/Crime Prevention for Women\", was on the agenda, with the recorded action quoted.",
  "id": "crime-prevention-women-2024--2024-02-13--item-12--action",
  "kind": "council_action",
  "matter_id": "crime-prevention-women-2024",
  "recommendation_ids": []
 },
 {
  "actor": "City Council",
  "citations": [
   {
    "locator": "Item 13, Recommendation (p. 8)",
    "source_id": "src-bcc-2024-02-13-regular-annotated-agenda"
   }
  ],
  "commitment_ids": [
   "west-berkeley-service-center-2024--2024-02-13--item-13"
  ],
  "date": "2024-02-13",
  "description": "Item 13, \"RFP for Development of West Berkeley Service Center (Continued from January 16, 2024)\", was on the agenda, with the recorded action quoted.",
  "id": "west-berkeley-service-center-2024--2024-02-13--item-13--action",
  "kind": "council_action",
  "matter_id": "west-berkeley-service-center-2024",
  "recommendation_ids": []
 },
 {
  "actor": "City Council",
  "citations": [
   {
    "locator": "Item 16, Action (p. 8)",
    "quote": "M/S/C (Arreguin/Hahn) to adopt first reading of Ordinance No. 7,898–N.S. Second reading scheduled for March 12, 2024. Referred to the City Manager a request to develop regulations and performance standards to mitigate noise impacts for Group Class Instruction uses.",
    "source_id": "src-bcc-2024-02-27-regular-annotated-agenda"
   }
  ],
  "commitment_ids": [
   "group-class-instruction-noise-2024--2024-02-27--item-16"
  ],
  "date": "2024-02-27",
  "description": "Item 16, \"Zoning Amendments for Berkeley Business; Amending Berkeley Municipal Code Title 23\", was on the agenda, with the recorded action quoted.",
  "id": "group-class-instruction-noise-2024--2024-02-27--item-16--action",
  "kind": "council_action",
  "matter_id": "group-class-instruction-noise-2024",
  "recommendation_ids": []
 },
 {
  "actor": "City Council",
  "citations": [
   {
    "locator": "Item 19, Action (p. 10)",
    "quote": "Approved recommendation.",
    "source_id": "src-bcc-2024-03-26-regular-annotated-agenda"
   }
  ],
  "commitment_ids": [
   "long-term-care-facility-oversight-2024--2024-03-26--item-19"
  ],
  "date": "2024-03-26",
  "description": "Item 19, \"Response to Council Referral: Long Term Care Facility Oversight\", was on the agenda, with the recorded action quoted.",
  "id": "long-term-care-facility-oversight-2024--2024-03-26--item-19--action",
  "kind": "council_action",
  "matter_id": "long-term-care-facility-oversight-2024",
  "recommendation_ids": []
 },
 {
  "actor": "City Council",
  "citations": [
   {
    "locator": "Item 33b, Action (p. 15)",
    "quote": "Approved recommendation in Item 33b.",
    "source_id": "src-bcc-2024-05-07-regular-annotated-agenda"
   }
  ],
  "commitment_ids": [
   "age-friendly-action-plan-2024--2024-05-07-0--item-33b"
  ],
  "date": "2024-05-07",
  "description": "Item 33b, \"Companion Report: Achieving Goals of 2018 Berkeley Age-Friendly Action Plan\", was on the agenda, with the recorded action quoted.",
  "id": "age-friendly-action-plan-2024--2024-05-07-0--item-33b--action",